<?xml version="1.0" encoding="UTF-8"?>
<xs:schema xmlns:xs="http://www.w3.org/2001/XMLSchema" elementFormDefault="qualified">

  <xs:element name="hr_system">
    <xs:complexType>
      <xs:sequence>
        <xs:element name="geography" type="geographyType"/>
        <xs:element name="departments" type="departmentsType"/>
      </xs:sequence>
    </xs:complexType>
  </xs:element>

  <xs:complexType name="geographyType">
    <xs:sequence>
      <xs:element name="region" maxOccurs="unbounded">
        <xs:complexType>
          <xs:sequence>
            <xs:element name="region_name" type="xs:string"/>
            <xs:element name="country" maxOccurs="unbounded">
              <xs:complexType>
                <xs:sequence>
                  <xs:element name="country_name" type="xs:string"/>
                  <xs:element name="location" maxOccurs="unbounded" minOccurs="0">
                    <xs:complexType>
                      <xs:sequence>
                        <xs:element name="street_address" type="xs:string" minOccurs="0"/>
                        <xs:element name="postal_code" type="xs:string" minOccurs="0"/>
                        <xs:element name="city" type="xs:string"/>
                        <xs:element name="state_province" type="xs:string" minOccurs="0"/>
                      </xs:sequence>
                      <xs:attribute name="location_id" type="xs:integer" use="required"/>
                    </xs:complexType>
                  </xs:element>
                </xs:sequence>
                <xs:attribute name="country_id" type="xs:string" use="required"/>
              </xs:complexType>
            </xs:element>
          </xs:sequence>
          <xs:attribute name="region_id" type="xs:integer" use="required"/>
        </xs:complexType>
      </xs:element>
    </xs:sequence>
  </xs:complexType>

  <xs:complexType name="departmentsType">
    <xs:sequence>
      <xs:element name="department" maxOccurs="unbounded">
        <xs:complexType>
          <xs:sequence>
            <xs:element name="department_name" type="xs:string"/>
            <xs:element name="manager_id" type="xs:integer" nillable="true" minOccurs="0"/>
            <xs:element name="location_id" type="xs:integer"/>
            
            <xs:element name="employees" minOccurs="0">
              <xs:complexType>
                <xs:sequence>
                  <xs:element name="employee" maxOccurs="unbounded">
                    <xs:complexType>
                      <xs:sequence>
                        <xs:element name="first_name" type="xs:string" minOccurs="0"/>
                        <xs:element name="last_name" type="xs:string"/>
                        <xs:element name="email" type="xs:string"/>
                        <xs:element name="phone_number" type="xs:string" minOccurs="0"/>
                        <xs:element name="hire_date" type="xs:date"/>
                        <xs:element name="job_id" type="xs:string"/> <xs:element name="salary" type="xs:decimal" minOccurs="0"/>
                        <xs:element name="commission_pct" type="xs:decimal" minOccurs="0"/>
                        <xs:element name="manager_id" type="xs:integer" minOccurs="0"/>
                        
                        <xs:element name="job_history" minOccurs="0" maxOccurs="unbounded">
                          <xs:complexType>
                            <xs:sequence>
                              <xs:element name="start_date" type="xs:date"/>
                              <xs:element name="end_date" type="xs:date"/>
                              <xs:element name="job_id" type="xs:string"/>
                              <xs:element name="department_id" type="xs:integer"/>
                            </xs:sequence>
                          </xs:complexType>
                        </xs:element>
                        
                      </xs:sequence>
                      <xs:attribute name="employee_id" type="xs:integer" use="required"/>
                    </xs:complexType>
                  </xs:element>
                </xs:sequence>
              </xs:complexType>
            </xs:element>
            
          </xs:sequence>
          <xs:attribute name="department_id" type="xs:integer" use="required"/>
        </xs:complexType>
      </xs:element>
    </xs:sequence>
  </xs:complexType>

</xs:schema>